{
  "schema_version": "1.0",
  "data_classification": "synthetic_no_participant_data",
  "fixture_id": "SYN-FIX-G0-001",
  "logical_time_block": "SYNTHETIC-2026-01",
  "experiment_manifest": {
    "profile_id": "SYN-P001",
    "protocol_id": "SYN-T001",
    "development_session_ids": [
      "SYN-S0001"
    ],
    "calibration_session_ids": [
      "SYN-S0002"
    ],
    "prospective_shadow_session_ids": [
      "SYN-S0003"
    ]
  },
  "attempts": [
    {
      "attempt_id": "SYN-A0001",
      "session_id": "SYN-S0003",
      "event_order": 1,
      "task_family": "T1_PROMPTED_KNOWN",
      "input_record_ids": [
        "SYN-R00000001"
      ],
      "observable_signal_code": "signal_a",
      "input_quality_code": "usable",
      "reference_semantic_id": "SYN-SEM-0001",
      "reference_source": "synthetic_oracle",
      "reference_timing": "pre_reveal",
      "scoring_eligible": true,
      "training_eligible": false,
      "authorship_claim_eligible": false,
      "ambiguity_status": "none",
      "usable_attempt": true,
      "cancelled": false,
      "exclusion_reason": null,
      "environment_code": "synthetic_quiet",
      "fatigue_state": "synthetic_low",
      "surface_relation": "exact_seen",
      "semantic_relation": "seen",
      "partner_familiarity": "familiar",
      "personal_vocabulary": false,
      "speech_variability_state": "synthetic_stable",
      "abstention_expected": false,
      "challenge_eligible": false
    },
    {
      "attempt_id": "SYN-A0002",
      "session_id": "SYN-S0003",
      "event_order": 2,
      "task_family": "T2_HELDOUT_PARAPHRASE",
      "input_record_ids": [
        "SYN-R00000002"
      ],
      "observable_signal_code": "signal_a",
      "input_quality_code": "usable",
      "reference_semantic_id": "SYN-SEM-0002",
      "reference_source": "synthetic_oracle",
      "reference_timing": "pre_reveal",
      "scoring_eligible": true,
      "training_eligible": false,
      "authorship_claim_eligible": false,
      "ambiguity_status": "none",
      "usable_attempt": true,
      "cancelled": false,
      "exclusion_reason": null,
      "environment_code": "synthetic_quiet",
      "fatigue_state": "synthetic_low",
      "surface_relation": "unseen_paraphrase",
      "semantic_relation": "seen",
      "partner_familiarity": "familiar",
      "personal_vocabulary": false,
      "speech_variability_state": "synthetic_stable",
      "abstention_expected": false,
      "challenge_eligible": false
    },
    {
      "attempt_id": "SYN-A0003",
      "session_id": "SYN-S0003",
      "event_order": 3,
      "task_family": "T1_PROMPTED_KNOWN",
      "input_record_ids": [
        "SYN-R00000003"
      ],
      "observable_signal_code": "signal_b",
      "input_quality_code": "usable",
      "reference_semantic_id": "SYN-SEM-0002",
      "reference_source": "synthetic_oracle",
      "reference_timing": "pre_reveal",
      "scoring_eligible": true,
      "training_eligible": false,
      "authorship_claim_eligible": false,
      "ambiguity_status": "none",
      "usable_attempt": true,
      "cancelled": false,
      "exclusion_reason": null,
      "environment_code": "synthetic_quiet",
      "fatigue_state": "synthetic_low",
      "surface_relation": "exact_seen",
      "semantic_relation": "seen",
      "partner_familiarity": "familiar",
      "personal_vocabulary": false,
      "speech_variability_state": "synthetic_stable",
      "abstention_expected": false,
      "challenge_eligible": false
    },
    {
      "attempt_id": "SYN-A0004",
      "session_id": "SYN-S0003",
      "event_order": 4,
      "task_family": "T2_HELDOUT_PARAPHRASE",
      "input_record_ids": [
        "SYN-R00000004"
      ],
      "observable_signal_code": "signal_b",
      "input_quality_code": "usable",
      "reference_semantic_id": "SYN-SEM-0003",
      "reference_source": "synthetic_oracle",
      "reference_timing": "pre_reveal",
      "scoring_eligible": true,
      "training_eligible": false,
      "authorship_claim_eligible": false,
      "ambiguity_status": "none",
      "usable_attempt": true,
      "cancelled": false,
      "exclusion_reason": null,
      "environment_code": "synthetic_quiet",
      "fatigue_state": "synthetic_low",
      "surface_relation": "unseen_paraphrase",
      "semantic_relation": "seen",
      "partner_familiarity": "unfamiliar",
      "personal_vocabulary": false,
      "speech_variability_state": "synthetic_variable",
      "abstention_expected": false,
      "challenge_eligible": false
    },
    {
      "attempt_id": "SYN-A0005",
      "session_id": "SYN-S0003",
      "event_order": 5,
      "task_family": "T1_PROMPTED_KNOWN",
      "input_record_ids": [
        "SYN-R00000005"
      ],
      "observable_signal_code": "signal_c",
      "input_quality_code": "usable",
      "reference_semantic_id": "SYN-SEM-0003",
      "reference_source": "synthetic_oracle",
      "reference_timing": "pre_reveal",
      "scoring_eligible": true,
      "training_eligible": false,
      "authorship_claim_eligible": false,
      "ambiguity_status": "none",
      "usable_attempt": true,
      "cancelled": false,
      "exclusion_reason": null,
      "environment_code": "synthetic_noise",
      "fatigue_state": "synthetic_mid",
      "surface_relation": "exact_seen",
      "semantic_relation": "seen",
      "partner_familiarity": "familiar",
      "personal_vocabulary": true,
      "speech_variability_state": "synthetic_variable",
      "abstention_expected": false,
      "challenge_eligible": false
    },
    {
      "attempt_id": "SYN-A0006",
      "session_id": "SYN-S0003",
      "event_order": 6,
      "task_family": "T3_NATURALISTIC",
      "input_record_ids": [
        "SYN-R00000006"
      ],
      "observable_signal_code": "signal_d",
      "input_quality_code": "unstable",
      "reference_semantic_id": "SYN-SEM-0004",
      "reference_source": "synthetic_oracle",
      "reference_timing": "pre_reveal",
      "scoring_eligible": true,
      "training_eligible": false,
      "authorship_claim_eligible": false,
      "ambiguity_status": "none",
      "usable_attempt": true,
      "cancelled": false,
      "exclusion_reason": null,
      "environment_code": "synthetic_noise",
      "fatigue_state": "synthetic_mid",
      "surface_relation": "unseen_paraphrase",
      "semantic_relation": "unseen",
      "partner_familiarity": "unfamiliar",
      "personal_vocabulary": true,
      "speech_variability_state": "synthetic_variable",
      "abstention_expected": false,
      "challenge_eligible": false
    },
    {
      "attempt_id": "SYN-A0007",
      "session_id": "SYN-S0003",
      "event_order": 7,
      "task_family": "T3_NATURALISTIC",
      "input_record_ids": [
        "SYN-R00000007"
      ],
      "observable_signal_code": "signal_a",
      "input_quality_code": "unstable",
      "reference_semantic_id": "SYN-SEM-0004",
      "reference_source": "synthetic_oracle",
      "reference_timing": "pre_reveal",
      "scoring_eligible": true,
      "training_eligible": false,
      "authorship_claim_eligible": false,
      "ambiguity_status": "synthetic_challenge",
      "usable_attempt": true,
      "cancelled": false,
      "exclusion_reason": null,
      "environment_code": "synthetic_noise",
      "fatigue_state": "synthetic_high",
      "surface_relation": "unseen_paraphrase",
      "semantic_relation": "unseen",
      "partner_familiarity": "unfamiliar",
      "personal_vocabulary": false,
      "speech_variability_state": "synthetic_unstable",
      "abstention_expected": true,
      "challenge_eligible": true
    },
    {
      "attempt_id": "SYN-A0008",
      "session_id": "SYN-S0003",
      "event_order": 8,
      "task_family": "T3_NATURALISTIC",
      "input_record_ids": [
        "SYN-R00000008"
      ],
      "observable_signal_code": "signal_b",
      "input_quality_code": "usable",
      "reference_semantic_id": "SYN-SEM-0001",
      "reference_source": "synthetic_oracle",
      "reference_timing": "pre_reveal",
      "scoring_eligible": true,
      "training_eligible": false,
      "authorship_claim_eligible": false,
      "ambiguity_status": "synthetic_challenge",
      "usable_attempt": true,
      "cancelled": false,
      "exclusion_reason": null,
      "environment_code": "synthetic_noise",
      "fatigue_state": "synthetic_high",
      "surface_relation": "unseen_paraphrase",
      "semantic_relation": "unseen",
      "partner_familiarity": "unfamiliar",
      "personal_vocabulary": false,
      "speech_variability_state": "synthetic_unstable",
      "abstention_expected": true,
      "challenge_eligible": true
    },
    {
      "attempt_id": "SYN-A0009",
      "session_id": "SYN-S0003",
      "event_order": 9,
      "task_family": "T1_PROMPTED_KNOWN",
      "input_record_ids": [
        "SYN-R00000009"
      ],
      "observable_signal_code": "signal_a",
      "input_quality_code": "unstable",
      "reference_semantic_id": "SYN-SEM-0001",
      "reference_source": "synthetic_oracle",
      "reference_timing": "pre_reveal",
      "scoring_eligible": false,
      "training_eligible": false,
      "authorship_claim_eligible": false,
      "ambiguity_status": "none",
      "usable_attempt": false,
      "cancelled": false,
      "exclusion_reason": "synthetic_unusable_input",
      "environment_code": "synthetic_quiet",
      "fatigue_state": "synthetic_low",
      "surface_relation": "exact_seen",
      "semantic_relation": "seen",
      "partner_familiarity": "familiar",
      "personal_vocabulary": false,
      "speech_variability_state": "synthetic_stable",
      "abstention_expected": true,
      "challenge_eligible": true
    },
    {
      "attempt_id": "SYN-A0010",
      "session_id": "SYN-S0003",
      "event_order": 10,
      "task_family": "T0_ACCESS_CONTROL",
      "input_record_ids": [
        "SYN-R00000010"
      ],
      "observable_signal_code": "signal_d",
      "input_quality_code": "usable",